{
  "schema_version": "2026-09-05.1",
  "run_id": "20260905T223146",
  "mode": "tableslice_v02_core",
  "source_pdf": {
    "path": "/Users/eric/Documents/copilot设计skilll/600941_中国移动_2025年度报告.pdf",
    "sha256_start": "8bde14d742b4869c344cc525ed892ec928d2eadf57757945c7e5a0e5bc3c7684",
    "sha256_end": null
  },
  "program": {
    "skill_version": "annual-report-markdown",
    "pipeline_version": "0.2.0-p0",
    "command_line": "run_tableslice.py"
  },
  "engines": {
    "renderer": "pdfplumber",
    "ocr": null,
    "layout": null,
    "table": "mineru-pipeline"
  },
  "config": {},
  "timing": {
    "started_at": "2026-09-05T22:31:46+08:00",
    "finished_at": "2026-09-05T22:31:46+08:00",
    "elapsed_seconds": null,
    "pages_processed": 1,
    "model_calls": 0
  },
  "failures": [
    "MinerU content_list 表数=1；切片保留=1"
  ],
  "page_status": [
    {
      "physical_page": 126,
      "status": "processed"
    }
  ],
  "output_dir": "samples/cmcc_p126",
  "overall_state": "partial"
}
